{
  "version": "0.1",
  "id": "proposal_compact_context_1",
  "steward": "newapi-compact-context-steward",
  "hook": "responses.compact.before_upstream",
  "outputs": [
    {
      "action": "ledger.artifact.create",
      "reason": "store compact summary as an external artifact reference",
      "artifact_type": "compact_summary",
      "content_hash": "sha256:cccccccccccccccccccccccccccccccccccccccccccccccccccccccccccccccc",
      "ref": "memory://summaries/session_codex_context_harness/compact_steward_1"
    },
    {
      "action": "context.inject",
      "reason": "inject compact-time working memory produced by the explicit steward",
      "role": "system",
      "position": "after_existing_system",
      "text": "Continue preserving the user's active goal, current blockers, verified decisions, and unresolved follow-ups from the compact summary artifact."
    },
    {
      "action": "diagnosis.note.create",
      "reason": "record why the compact steward injected continuity guidance",
      "note_hash": "sha256:dddddddddddddddddddddddddddddddddddddddddddddddddddddddddddddddd",
      "ref": "memory://diagnostics/session_codex_context_harness/compact_steward_1",
      "severity": "info"
    },
    {
      "action": "session.tags.update",
      "reason": "mark the session as compact-stewarded for later audit",
      "tags": ["continuity:compacted", "steward:ai-in-loop"]
    }
  ]
}
